<?xml version="1.0" encoding="UTF-8"?>
<data xmlns="http://www.woltlab.com" xmlns:xsi="http://www.w3.org/2001/XMLSchema-instance" xsi:schemaLocation="http://www.woltlab.com http://www.woltlab.com/XSD/vortex/templateListener.xsd">
	<import>
		<templatelistener name="articleSortField">
			<environment>admin</environment>
			<templatename>categoryAdd</templatename>
			<eventname>dataFields</eventname>
			<templatecode><![CDATA[{include file='__articleSortField'}]]></templatecode>
		</templatelistener>
	</import>
	<delete>
		<templatelistener name="articleShowOrder">
			<environment>admin</environment>
			<templatename>categoryAdd</templatename>
			<eventname>dataFields</eventname>
		</templatelistener>
	</delete>
</data>
